{
  "$defs": {
    "MigrationPlan": {
      "description": "A topologically-orderable set of plan steps.",
      "properties": {
        "steps": {
          "default": [],
          "items": {
            "$ref": "#/$defs/PlanStep"
          },
          "title": "Steps",
          "type": "array"
        }
      },
      "title": "MigrationPlan",
      "type": "object"
    },
    "PlanStep": {
      "description": "One ordered unit of a migration plan.",
      "properties": {
        "application_action": {
          "anyOf": [
            {
              "minLength": 1,
              "type": "string"
            },
            {
              "type": "null"
            }
          ],
          "default": null,
          "title": "Application Action"
        },
        "backfill_or_validation": {
          "anyOf": [
            {
              "minLength": 1,
              "type": "string"
            },
            {
              "type": "null"
            }
          ],
          "default": null,
          "title": "Backfill Or Validation"
        },
        "dependency_ids": {
          "default": [],
          "items": {
            "minLength": 1,
            "type": "string"
          },
          "title": "Dependency Ids",
          "type": "array"
        },
        "deployment_boundary": {
          "minLength": 1,
          "title": "Deployment Boundary",
          "type": "string"
        },
        "id": {
          "minLength": 1,
          "title": "Id",
          "type": "string"
        },
        "recommendation": {
          "pattern": "^[A-Z][A-Z0-9]{1,15}-[0-9]{3,6}$",
          "title": "Recommendation",
          "type": "string"
        },
        "rollback_note": {
          "minLength": 1,
          "title": "Rollback Note",
          "type": "string"
        },
        "scenario": {
          "$ref": "#/$defs/ScenarioKind"
        },
        "schema_action": {
          "minLength": 1,
          "title": "Schema Action",
          "type": "string"
        },
        "verification_requirement": {
          "minLength": 1,
          "title": "Verification Requirement",
          "type": "string"
        }
      },
      "required": [
        "id",
        "recommendation",
        "scenario",
        "schema_action",
        "deployment_boundary",
        "rollback_note",
        "verification_requirement"
      ],
      "title": "PlanStep",
      "type": "object"
    },
    "ScenarioKind": {
      "enum": [
        "launch_minimal",
        "growth_ready",
        "availability_ready"
      ],
      "title": "ScenarioKind",
      "type": "string"
    }
  },
  "$id": "https://pgproof.dev/contracts/1.2/migration_plan.schema.json",
  "$schema": "https://json-schema.org/draft/2020-12/schema",
  "description": "Transport envelope for the pgproof migration_plan artifact, contract schema version 1.2.",
  "properties": {
    "artifact_type": {
      "const": "migration_plan",
      "title": "Artifact Type",
      "type": "string"
    },
    "created_at": {
      "description": "RFC 3339 timestamp in UTC, ending in 'Z'.",
      "pattern": "^\\d{4}-\\d{2}-\\d{2}T\\d{2}:\\d{2}:\\d{2}(?:\\.\\d{1,9})?Z$",
      "title": "Created At",
      "type": "string"
    },
    "data": {
      "$ref": "#/$defs/MigrationPlan"
    },
    "inputs": {
      "additionalProperties": {
        "pattern": "^sha256:[0-9a-f]{64}$",
        "type": "string"
      },
      "title": "Inputs",
      "type": "object"
    },
    "run_id": {
      "pattern": "^[0-9A-HJKMNP-TV-Z]{26}$",
      "title": "Run Id",
      "type": "string"
    },
    "schema_version": {
      "default": "1.2",
      "pattern": "^1\\.(0|[1-9][0-9]*)$",
      "title": "Schema Version",
      "type": "string"
    },
    "tool_version": {
      "pattern": "^[0-9]+\\.[0-9]+\\.[0-9]+(?:[.\\-+][0-9A-Za-z.\\-+]+)?$",
      "title": "Tool Version",
      "type": "string"
    }
  },
  "required": [
    "tool_version",
    "artifact_type",
    "created_at",
    "run_id",
    "data"
  ],
  "title": "MigrationPlanArtifact",
  "type": "object"
}
